{
  "$schema": "https://json-schema.org/draft/2020-12/schema",
  "$id": "https://jarod-os.invalid/contracts/v1/c10-update-manifest.schema.json",
  "title": "Update manifest (the signed list of what an update contains)",
  "description": "`manifest.json` of an update bundle, signed as a whole by `manifest.sig` (an ECDSA P-256 / SHA-256 signature, base64 DER, over the exact bytes of this file; the public key is the one committed for the images, `linux/image/cosign.pub`). The host refuses an unsigned or wrongly signed manifest, a file whose hash or size differs, a file the manifest does not list, a path that is not a plain relative one, and a version that is not newer than the installed one. There is no unsigned channel: `stable` and `edge` are both signed. Provisional: written by the Rust host's updater (phase 2.5), no CI producer yet.",
  "type": "object",
  "required": [
    "schema",
    "product",
    "version",
    "channel",
    "createdAt",
    "entry",
    "files"
  ],
  "properties": {
    "schema": {
      "const": 1
    },
    "product": {
      "const": "jarod-os"
    },
    "version": {
      "type": "string",
      "pattern": "^(0|[1-9][0-9]*)\\.(0|[1-9][0-9]*)\\.(0|[1-9][0-9]*)$",
      "description": "major.minor.patch, no pre-release and no build metadata."
    },
    "channel": {
      "enum": [
        "stable",
        "edge"
      ]
    },
    "createdAt": {
      "type": "string",
      "pattern": "^\\d{4}-\\d{2}-\\d{2}T\\d{2}:\\d{2}:\\d{2}(\\.\\d+)?Z$"
    },
    "entry": {
      "type": "string",
      "minLength": 1,
      "maxLength": 240,
      "pattern": "^[A-Za-z0-9._-]+(/[A-Za-z0-9._-]+)*$",
      "not": {
        "type": "string",
        "pattern": "(^|/)\\.\\.?(/|$)"
      },
      "description": "The program the slot is started from; it must be one of `files`."
    },
    "files": {
      "type": "array",
      "minItems": 1,
      "maxItems": 20000,
      "items": {
        "type": "object",
        "required": [
          "path",
          "sha256",
          "size"
        ],
        "properties": {
          "path": {
            "type": "string",
            "minLength": 1,
            "maxLength": 240,
            "pattern": "^[A-Za-z0-9._@-]+(/[A-Za-z0-9._@-]+)*$",
            "not": {
              "type": "string",
              "pattern": "(^|/)\\.\\.?(/|$)"
            },
            "description": "Relative, forward slashes, plain names only: no `..`, no drive, no stream, no space. `@` is allowed (npm scoped packages, `node_modules/@scope/name`, in the packaged app); the entry stays without it."
          },
          "sha256": {
            "type": "string",
            "pattern": "^[0-9a-f]{64}$"
          },
          "size": {
            "type": "integer",
            "minimum": 0,
            "maximum": 17179869184
          }
        },
        "additionalProperties": false
      }
    }
  },
  "additionalProperties": false
}
