{
  "schema": 1,
  "product": "jarod-os",
  "version": "0.2.0",
  "channel": "stable",
  "createdAt": "2026-10-16T12:00:00Z",
  "entry": "run.exe",
  "files": [
    {
      "path": "run.exe",
      "sha256": "0123456789abcdef0123456789abcdef0123456789abcdef0123456789abcdef",
      "size": 1
    }
  ]
}
