{
  "schema": 1,
  "product": "jarod-os",
  "version": "10.0.123",
  "channel": "edge",
  "createdAt": "2026-10-16T12:00:00.250Z",
  "entry": "bin/herald-host.exe",
  "files": [
    {
      "path": "bin/herald-host.exe",
      "sha256": "0123456789abcdef0123456789abcdef0123456789abcdef0123456789abcdef",
      "size": 4194304
    },
    {
      "path": "resources/jarod-core/gateway.mjs",
      "sha256": "ffffffffffffffffffffffffffffffffffffffffffffffffffffffffffffffff",
      "size": 123456
    },
    {
      "path": "README.txt",
      "sha256": "aaaaaaaaaaaaaaaaaaaaaaaaaaaaaaaaaaaaaaaaaaaaaaaaaaaaaaaaaaaaaaaa",
      "size": 0
    }
  ]
}
