{
  "schema": 1,
  "product": "jarod-os",
  "version": "0.3.0",
  "channel": "stable",
  "createdAt": "2026-10-24T12:00:00Z",
  "entry": "Jarod-OS.exe",
  "files": [
    {
      "path": "Jarod-OS.exe",
      "sha256": "0123456789abcdef0123456789abcdef0123456789abcdef0123456789abcdef",
      "size": 180000000
    },
    {
      "path": "resources/pinokiod/node_modules/@hapi/hoek/lib/index.js",
      "sha256": "aaaaaaaaaaaaaaaaaaaaaaaaaaaaaaaaaaaaaaaaaaaaaaaaaaaaaaaaaaaaaaaa",
      "size": 3112
    }
  ]
}
